{"claimed_at":"2026-09-18T01:49:50+00:00","expires_at":"2026-09-18T05:49:50+00:00","generation":1,"heartbeat_at":"2026-09-18T01:49:50+00:00","intent":"Own only .github/workflows/insect-desktop-recovery.yml for native builds","owner":"astra-insect-recovery-e82f","protocol_version":"1.0","schema_version":1,"scope":"ci-insect-desktop-recovery","state":"active","task_id":"recover-insect-desktop-e82f"}
