{
  "claimed_at": "2026-09-19T01:34:10+00:00",
  "expires_at": "2026-09-19T05:34:10+00:00",
  "generation": 1,
  "heartbeat_at": "2026-09-19T01:34:10+00:00",
  "intent": "Run full macOS and Windows application build/package qualification separately from existing source-recovery workflow; never infer native input acceptance from compilation.",
  "owner": "astra-insect-resume-m5r2",
  "protocol_version": "1.0",
  "schema_version": 1,
  "scope": ".github/workflows/insect-packages-m5r2.yml",
  "state": "active",
  "task_id": "insect-continuation-03-q7b4"
}
