{
  "schema_version": 1,
  "protocol_version": "1.0",
  "task_id": "prune-superseded-branches-2026-08-24",
  "scope": ".github/workflows/prune-superseded-branches.yml",
  "owner": "openai-branch-prune-8e51",
  "state": "released",
  "intent": "Add a one-shot fail-closed branch-pruning workflow with dynamic PR protection and archive verification.",
  "claimed_at": "2026-08-24T12:19:05Z",
  "heartbeat_at": "2026-08-24T12:19:05Z",
  "expires_at": "2026-08-24T14:19:05Z",
  "generation": 1,
  "released_at": "2026-08-24T12:50:49.482021+00:00",
  "release_reason": "Physical branch prune completed, recovery archive verified, temporary machinery removed, and final closeout verification started"
}
