{
  "schema_version": 1,
  "protocol_version": "1.0",
  "task_id": "build-insect-desktop-20260917-d41e",
  "scope": "projects/insect-realism-desktop-app",
  "owner": "astra-insect-desktop-d41e",
  "state": "active",
  "intent": "New isolated desktop app project based on clean main; consume supplied research artifact rather than editing research branches.",
  "claimed_at": "2026-09-17T22:07:00+00:00",
  "heartbeat_at": "2026-09-17T22:07:00+00:00",
  "expires_at": "2026-09-18T02:07:00+00:00",
  "generation": 1
}
