{
  "schema_version": 1,
  "protocol_version": "1.0",
  "task_id": "glazed-boze-26-1-2-port",
  "scope": "foundation",
  "owner": "chatgpt-glazed-inline-8f31",
  "state": "active",
  "intent": "Implement and verify Plan 01 foundation for the private local Glazed to Boze 26.1.2 port; publish only hashes and test summaries to the Agents repo.",
  "claimed_at": "2026-09-01T20:31:00+00:00",
  "heartbeat_at": "2026-09-01T20:31:00+00:00",
  "expires_at": "2026-09-02T02:31:00+00:00",
  "generation": 1
}
