{"schema_version":1,"protocol_version":"1.0","task_id":"insect-verify-c9a2","scope":".github/workflows/insect-qualify-c9a2.yml","owner":"astra-insect-verify-c9a2","state":"active","intent":"New native build and packaging workflow only; all previous workflows remain untouched","claimed_at":"2026-09-18T18:45:00+00:00","heartbeat_at":"2026-09-18T18:45:00+00:00","expires_at":"2026-09-19T02:45:00+00:00","generation":1}
