{
  "claimed_at": "2026-09-18T22:51:22+00:00",
  "expires_at": "2026-09-19T05:34:10+00:00",
  "generation": 1,
  "heartbeat_at": "2026-09-19T01:34:10+00:00",
  "intent": "Continue exact source publication, preserve the newer spatial fix, qualify two tested settings repairs, and finish native package evidence; do not restart or edit other project roots.",
  "owner": "astra-insect-resume-m5r2",
  "protocol_version": "1.0",
  "schema_version": 1,
  "scope": "projects/insect-realism-desktop-app",
  "state": "released",
  "task_id": "insect-continuation-03-q7b4",
  "released_at": "2026-09-19T04:08:13+00:00",
  "release_reason": "Continuation source publication and native package qualification completed; remaining gates require physical-machine acceptance."
}
