{
  "schema_version": 1,
  "protocol_version": "1.0",
  "task_id": "natural-aim-pvp-fix-26-2-20260922",
  "scope": ".github/workflows/natural-aim-assist-26-2.yml",
  "owner": "openai-natural-aim-pvp-fix-26-2-b47e",
  "state": "active",
  "intent": "Implement and verify PvP tracking fixes.",
  "claimed_at": "2026-09-22T22:42:02+00:00",
  "heartbeat_at": "2026-09-22T22:42:02+00:00",
  "expires_at": "2026-09-23T22:42:02+00:00",
  "generation": 1
}
