{"schema_version":1,"protocol_version":"1.0","task_id":"insect-verify-c9a2","scope":"projects/insect-realism-qualified-c9a2","owner":"astra-insect-verify-c9a2","state":"active","intent":"Use a new non-overlapping qualification root; leave original, recovery and release-root leases untouched. The supplied archives are the implementation dependency.","claimed_at":"2026-09-18T18:45:00+00:00","heartbeat_at":"2026-09-18T18:45:00+00:00","expires_at":"2026-09-19T02:45:00+00:00","generation":1}
