{"schema_version":1,"protocol_version":"1.0","task_id":"finish-insect-desktop-f19b","scope":"projects/insect-realism-desktop-app","owner":"astra-insect-finish-f19b","state":"active","intent":"Resume user-provided recovery checkpoint at original project root; original root lease expired at 02:07 UTC; unexpired recovery-root lease remains untouched","claimed_at":"2026-09-18T04:55:00+00:00","heartbeat_at":"2026-09-18T04:55:00+00:00","expires_at":"2026-09-18T12:55:00+00:00","generation":1}
