{
  "schema_version": 1,
  "protocol_version": "1.0",
  "task_id": "natural-aim-assist-fix-26-2-20260922",
  "scope": ".github/workflows/natural-aim-assist-26-2.yml",
  "owner": "openai-natural-aim-fix-26-2-9c2a",
  "state": "active",
  "intent": "Implement and verify Natural Aim Assist 26.2 runtime/UI fixes.",
  "claimed_at": "2026-09-22T21:41:30+00:00",
  "heartbeat_at": "2026-09-22T21:41:30+00:00",
  "expires_at": "2026-09-23T21:41:30+00:00",
  "generation": 1
}
