{
  "claimed_at": "2026-08-01T15:48:00+00:00",
  "expires_at": "2026-08-01T19:48:00+00:00",
  "generation": 1,
  "heartbeat_at": "2026-08-01T15:48:00+00:00",
  "intent": "Implement and verify post-first-run hardening only within this declared scope.",
  "owner": "openai-workspace-maint-b7e2",
  "protocol_version": "1.0",
  "release_reason": "Hardening merged and CI verified",
  "released_at": "2026-08-01T16:18:13+00:00",
  "schema_version": 1,
  "scope": "schemas/agent.schema.json",
  "state": "released",
  "task_id": "harden-agent-workspace-after-first-run"
}
